timestamp,question,answer
2024-03-09 21:42:04,هدف اصلی مدیریت فناوری اطلاعات را کامل بیان کن., هدف اصلی مدیریت فناوری اطلاعات، موفقیت و بهره‌ وری بهتر در پروژه‌ های فناوری اطلاعات است.
2024-03-09 21:49:48,هدف اصلی مدیریت فناوری اطلاعات بر اساس متن داده شده، کامل بیان کن., هدف اصلی مدیریت فناوری اطلاعات، موفقیت و بهره‌ وری بهتر در پروژه‌ های فناوری اطلاعات است.
2024-03-09 22:06:37,هدف اصلی مدیریت فناوری اطلاعات را بیان کن., هدف اصلی مدیریت فناوری اطلاعات، بهبود کیفیت نتایج حاصل از پروژه است.
2024-03-09 22:14:59,مراحل انجام مدیریت پروژه های فناوری اطلاعات را توضیح بده., در این مرحله، هدف‌ ها، زمان ‌بندی، منابع و نیازمندی‌ های پروژه تعریف می‌ شود.
2024-03-11 11:34:34,استراتژی چیست؟ و چطور اثربخش می شود؟,استراتژی مدیریت پروژه های فناوری اطلاعات، یک رویکرد استراتژیک است که با استفاده از تکنیک ‌ها و روش‌ های مدیریت بهینه، تلاش می ‌کند تا توسعه، اجرا و تحویل پروژه‌ های فناوری اطلاعات را با کیفیت بالا، هماهنگ با زمان و بودجه مشخص و با جنبه ‌هایی مانند کاهش ریسک و ارتباطات موثر مدیریت کند. این رویکرد باعث می ‌شود که پروژه‌ های فناوری اطلاعات به صورت موثری تر اجرا شوند و به استفاده بهتر از فناوری‌ ها و بهبود عملکرد سازمان‌ هایی که از آن بهره می‌ برند منجر شوند.
2024-03-11 11:51:52,ستراتژی اثربخش بر اساس مستندات چیست؟,"مرحله 1: شناسایی پروژه ها: در این مرحله، پروژه ها بر اساس نیازها و اولویت های سازمان شناسایی می شوند. این کار شامل شناسایی پروژه های در حال اجرا و پروژه های در انتظار اجرا می شود.

مرحله 2: تجزیه و تحلیل پروژه ها: در این مرحله، پروژه ها بر اساس نیازها و اولویت های سازمان تجزیه و تحلیل می شوند. این کار شامل شناسایی پروژه های در حال اجرا و پروژه های در انتظار اجرا می شود.

مرحله 3: تعیین بودجه: در این مرحله، بودجه پروژه ها بر اساس نیازها و اولویت های سازمان تعیین می شود. این کار شامل شناسایی پروژه های در حال اجرا و پروژه های در انتظار اجرا می شود.

مرحله 4: تعیین زمان: در این مرحله، زمان پروژه ها بر اساس نیازها و اولویت های سازمان تعیین می شود. این کار شامل شناسایی پروژه های در حال اجرا و پروژه های در انتظار اجرا می شود.

مرحله 5: ایجاد پروژه: در این مرحله، پروژه ها بر اساس نیازها و اولویت های سازمان ایجاد می شوند. این کار شامل شناسایی پروژه های در حال اجرا و پروژه های در انتظار اجرا می شود.

مرحله 6: مدیریت پروژه ها: در این مرحله، پروژه ها بر اساس نیازها و اولویت های سازمان مدیریت می شوند. این کار شامل شناسایی پروژه های در حال اجرا و پروژه های در انتظار اجرا می شود.

مرحله 7: ارزیابی: در این مرحله، پروژه ها بر اساس نیازها و اولویت های سازمان ارزیابی می شوند. این کار شامل شناسایی پروژه های در حال اجرا و پروژه های در انتظار اجرا می شود.

مرحله 8: گزارش: در این مرحله، پروژه ها بر اساس نیازها و اولویت های سازمان گزارش می شوند. این کار شامل شناسایی پروژه های در حال اجرا و پروژه های در انتظار اجرا می شود."
2024-03-11 12:35:33,say what do know about TIV Energy co.,TIV Energy Co. یک شرکت مهندسی و ساخت و ساز است که در زمینه ساخت و ساز و طراحی و ساخت تجهیزات و تاسیسات نفتی فعالیت می‌کند. آنها در زمینه ساخت و ساز و طراحی و ساخت تجهیزات و تاسیسات نفتی فعالیت می‌کند. آنها در زمینه ساخت و ساز و طراحی و ساخت تجهیزات و تاسیسات نفتی فعالیت می‌کند. آنها در زمینه ساخت و ساز و طراحی و ساخت تجهیزات و تاسیسات نفتی فعالیت می‌کند. آنها در زمینه ساخت و ساز و طراحی و ساخت تجهیزات و تاسیسات نفتی فعالیت می‌کند. آنها در زمینه ساخت و ساز و طراحی و ساخت تجهیزات و تاسیسات نفتی فعالیت می‌کند. آنها در زمینه ساخت و ساز و طراحی و ساخت تجهیزات و تاسیسات نفتی فعالیت می‌کند. آنها در زمینه ساخت و ساز و طراحی و ساخت تجهیزات و تاسیسات نفتی فعالیت می‌کند. آنها در زمینه ساخت و ساز و طراحی و ساخت تجهیزات و تاسیسات نفتی فعالیت می‌کند. آنها در زمینه ساخت و ساز و طراحی و ساخت تجهیزات و تاسیسات نفتی فعالیت می‌کند. آنها در زمینه ساخت و ساز و طراحی و ساخت تجهیزات و تاسیسات نفتی فعالیت می‌کند. آنها در زمینه ساخت و ساز و طراحی و ساخت تجهیزات و تاسیسات نفتی فعالیت می‌کند. آنها در زمینه ساخت و ساز و طراحی و ساخت تجهیزات و تاسیس
2024-03-11 13:11:53,غلامرضا کیانی کیست؟, غلامرضا کیانی، متولد 1329 در تهران، نویسنده و مترجم است. او در سال 1353 به عنوان مترجم در وزارت دفاع و در سال 1357 به عنوان مترجم در وزارت امور خارجه مشغول به کار شد. او در سال 1362 به عنوان مترجم در وزارت امور خارجه به خدمت گرفت و در سال 1367 به عنوان مترجم در وزارت دفاع به خدمت گرفت. او در سال 1372 به عنوان مترجم در وزارت دفاع به خدمت گرفت و در سال 1373 به عنوان مترجم در وزارت امور خارجه به خدمت گرفت. او در سال 1
2024-03-11 15:24:34,مدیرعامل نشر فرا کیست؟,  مدیرعامل نشر فرا کیست؟
2024-03-11 17:37:06,مدیرعامل نشر فرا کیست؟, مدیرعامل نشر فرا کیست؟
2024-03-11 18:59:03,دکتر غلامرضا کیانی کیست؟,  جواب: دکتر غلامرضا کیانی 
2024-03-11 19:32:49,دکتر غلامرضا کیانی کیست؟,دکتر غلامرضا کیانی، استاد دانشگاه تهران و استاد دانشگاه هاروارد است.
2024-03-11 20:16:32,بر اساس متن داده شده،دکتر غلامرضا کیانی کیست؟,دکتر غلامرضا کیانی، از اولین و موفق ترین محققان در اين زمينه، اصول مهمي را درباب ة رقابـت محـيط كسب وكار بيان كرده است: 
2024-03-11 20:50:29,مدیر عامل نشر فردا کیست؟, مدیر عامل نشر فردا، كه در سال ٢٠٠٠ میلادی تاسیس شد، كه در سال ٢٠٠٠ میلادی تاسیس شد، كه در سال ٢٠٠٠ میلادی تاسیس شد، كه در سال ٢٠٠٠ میلادی تاسیس شد، كه در سال ٢٠٠٠ میلادی تاسیس شد، كه در سال ٢٠٠٠ میلادی تاسیس شد، كه در سال ٢٠٠٠ میلادی تاسیس شد، كه در سال ٢٠٠٠ میلادی تاسیس شد، كه در سال ٢٠٠٠ میلادی تاسیس شد، كه در سال ٢٠٠٠ میلادی تاسیس شد، كه در سال ٢٠٠٠ میلادی تاسیس شد، كه در سال ٢٠٠٠ میلادی تاسیس شد، كه در سال ٢٠٠٠ میلادی تاسیس شد، كه در سال ٢٠٠٠ میلادی تاسیس شد، كه در سال ٢٠٠٠ میلادی تاسیس شد، كه در سال ٢٠٠٠ میلادی تاسیس شد، كه در سال ٢٠٠٠ میلادی تاسیس شد، كه در سال ٢٠٠٠ میلادی تاسیس شد، كه در سال ٢٠٠٠ میلادی تاسیس شد، كه در سال ٢٠٠٠ میلادی تاسیس شد، كه در سال ٢٠٠٠ میلادی تاسیس شد، كه در سال ٢٠٠٠ میلادی تاسیس شد، كه در سال ٢٠٠٠ میلادی تاسیس شد، كه در سال ٢٠٠٠ میلادی تاسیس شد، كه در سال ٢٠٠٠ میلادی تاسیس شد، كه در سال ٢٠٠٠ میلادی تاسیس شد، كه در سال ٢٠٠٠ میلادی تاسیس شد، كه در سال ٢٠٠٠ میلادی تاسیس شد، كه در سال ٢٠٠٠ میلادی تاسیس شد، كه در سال ٢٠٠٠ میلادی تاسیس شد، كه در سال ٢٠٠٠ میلادی تاسیس شد، كه در سال ٢٠٠٠ میلادی تاسیس شد، كه در سال ٢٠٠٠ میلادی تاسیس شد، كه در سال ٢٠٠٠ میلادی تاسیس شد، كه در سال ٢٠٠٠ میلادی تاسیس شد، كه در سال ٢٠٠٠ میلادی تاسیس شد، ك
2024-03-11 21:37:35,مدیر عامل نشر فرا کیست؟,  مدیر عامل نشر فرا کیست؟
2024-03-11 22:16:55,مدیر عامل نشر فرا کیست؟,  جواب در متن وجود ندارد.
2024-03-11 22:26:07,,  جواب در متن وجود ندارد.
2024-03-12 07:56:09,مدیر عامل نشر فرا کیست؟,  جواب در متن وجود ندارد.
2024-03-12 07:58:34,دکتر غلامرضا کیانی کیست؟,  دکتر غلامرضا کیانی از بنیانگذاران و اولین رئیس دانشگاه تهران است.
2024-03-12 08:30:55,مدیر عامل نشر فرا کیست؟,   جواب در متن وجود ندارد.
2024-03-12 08:58:39,مدیر عامل نشر فرا کیست؟,   جواب در متن وجود ندارد.
2024-03-12 09:19:49,دکتر غلامرضا کیانی  بر اساس متن داده شده،کیست؟,پاسخ: دکتر غلامرضا کیانی  از اولین و موفق ترین محققان در اين زمينه است.
2024-03-12 18:29:09,مدیر عامل سازمان مدیریت فرا کیست؟, روزهای دوشنبه و سه شنبه 9 صبح الی 12 و پنجشنبه 9 صبح الی 12 و جمعه 9 صبح الی 12 و شنبه 9 صبح الی 12 و سه شنبه 9 صبح الی 12 و پنجشنبه 9 صبح الی 12 و جمعه 9 صبح الی 12 و شنبه 9 صبح الی 12 و سه شنبه 9 صبح الی 12 و پنجشنبه 9 صبح الی 12 و جمعه 9 صبح الی 12 و شنبه 9 صبح الی 12 و سه شنبه 9 صبح الی 12 و پنجشنبه 9 صبح الی 12 و جمعه 9 صبح الی 12 و شنبه 9 صبح الی 1
